<?xml version="1.0" encoding="UTF-8"?>
<?xml-stylesheet type="text/xsl" href="stylesheetxsl.xsl"?>
<!-- Filnamn: english.xml -->
<!-- Författare: Olivia Fabreschi -->
<!-- Datum: 23 Mars 2024 -->
<!-- CSS stylesheet-->
<!-- <?xml-stylesheet type="text/css" href="stylesheet.css" ?> -->
<!-- DTD schema-->
<!--<!DOCTYPE dictionary SYSTEM "dtdSchema.dtd" >-->
<dictionary xmlns:xsi="http://www.w3.org/2001/XMLSchema-instance" xsi:noNamespaceSchemaLocation="schemaxml.xsd" language="English">
    <!-- Engelsk ordbok -->
    <title>English Dictionary</title>
    <author>Olivia</author>
    <words>
        <!-- numrerar orden för att lättare kunna matcha de till de olika språken-->
        <word ID = "1">Cat</word>
        <word ID = "2">Dog</word>
        <word ID = "3">Hello</word>
        <word ID = "4">Goodbye</word>
        <word ID = "5">Red</word>
        <word ID = "6">Blue</word>
        <word ID = "7">House</word>
        <word ID = "8">Mug</word>
        <word ID = "9">Mountain</word>
        <word ID = "10">Think</word>
    </words>
</dictionary>